platform,date,text,author,upvotes,url,Sentiment_Score,Conflict,clean_text
Mastodon,2026-04-24,# EU approves a $106 billion loan package to help # Ukraine - https:// kensbookinfo.blogspot.com/p/et c.html#Russia Formula 1 returns to Turkiye's # Istanbul Park - https:// kensbookinfo.blogspot.com/p/uk .html#4 2026 # Toyota Corolla Cross XLE AWD First Look - https:// kensbookinfo.blogspot.com/p/bu siness.html#1 # Australia reflects on service and sacrifice - https:// kensbookinfo.blogspot.com/p/et c-continents.html#Australia Aquarius # Horoscope 24 Apr 2026 - https:// kensbookinfo.blogspot.com/p/in terest.html#21 The # NewWave in Seafood - https:// kensbookinfo.blogspot.com/p/po litics.html#13 View all cultural news https:// kensbookinfo.blogspot.com/2026 /03/latest-cultural-news.html,kensbookinfo,0,https://mastodon.social/ap/users/115622491419196539/statuses/116461096088005693,0.11666666666666665,Ukraine War,eu approves a billion loan package to help ukraine kensbookinfo blogspot com p et c html russia formula returns to turkiye s istanbul park kensbookinfo blogspot com p uk html toyota corolla cross xle awd first look kensbookinfo blogspot com p bu siness html australia reflects on service and sacrifice kensbookinfo blogspot com p et c continents html australia aquarius horoscope apr kensbookinfo blogspot com p in terest html the newwave in seafood kensbookinfo blogspot com p po litics html view all cultural news kensbookinfo blogspot com latest cultural news html
Mastodon,2026-04-24,Most peaceful countries: 1. 🇮🇸 Iceland 2. 🇮🇪 Ireland 3. 🇳🇿 New Zealand 4. 🇦🇹 Austria 5. 🇨🇭 Switzerland 6. 🇸🇬 Singapore 7. 🇵🇹 Portugal 8. 🇩🇰 Denmark 9. 🇸🇮 Slovenia 10. 🇫🇮 Finland ~ 11. 🇨🇿 Czech Republic 12. 🇯🇵 Japan 13. 🇲🇾 Malaysia 14. 🇨🇦 Canada 17. 🇭🇺 Hungary 18. 🇦🇺 Australia 20. 🇩🇪 Germany 25. 🇪🇸 Spain 27. 🇶🇦 Qatar 30. 🇬🇧 UK 33. 🇮🇹 Italy 35. 🇸🇪 Sweden 41. 🇰🇷 South Korea 46. 🇦🇷 Argentina 49. 🇮🇩 Indonesia 74. 🇫🇷 France 90. 🇸🇦 Saudi Arabia 98. 🇨🇳 China 123. 🇧🇩 Bangladesh 105. 🇵🇭 Philippines 107. 🇪🇬 Egypt 115. 🇮🇳 India 128. 🇺🇸 USA 130. 🇧🇷 Brazil 135. 🇲🇽 Mexico 144. 🇵🇰 Pakistan 146. 🇹🇷 Turkey 149. 🇰🇵 North Korea 155. 🇮🇱 Israel 158. 🇦🇫 Afghanistan 162. 🇺🇦 Ukraine 163. 🇷🇺 Russia According to Global Peace Index,stats_feed,2,https://zpravobot.news/ap/users/116262997621803280/statuses/116459556055495938,0.2215909090909091,Ukraine War,most peaceful countries iceland ireland new zealand austria switzerland singapore portugal denmark slovenia finland czech republic japan malaysia canada hungary australia germany spain qatar uk italy sweden south korea argentina indonesia france saudi arabia china bangladesh philippines egypt india usa brazil mexico pakistan turkey north korea israel afghanistan ukraine russia according to global peace index
Mastodon,2026-04-24,Donald Trump hits back after Harry’s impassioned Ukraine speech https://www. standard.co.uk/news/uk/donald- trump-ukraine-sussex-duchess-australia-b1279828.html?utm_source=flipboard&utm_medium=activitypub Posted into Royal Family News @ royal-family-news-FlipboardUK,FlipboardUK,0,https://flipboard.com/users/FlipboardUK/statuses/GRhKMdH8Rc-ssdww47hchQ:a:26228122,0.0,Ukraine War,donald trump hits back after harry s impassioned ukraine speech standard co uk news uk donald trump ukraine sussex duchess australia b html utm source flipboard utm medium activitypub posted into royal family news royal family news flipboarduk
Mastodon,2026-04-24,Donald Trump hits back after Harry’s impassioned Ukraine speech https://www. standard.co.uk/news/uk/donald- trump-ukraine-sussex-duchess-australia-b1279828.html?utm_source=flipboard&utm_medium=activitypub Posted into The Evening Standard @ the-evening-standard-EveningStandard,EveningStandard,0,https://flipboard.com/users/EveningStandard/statuses/YfNGQG-7RT-Ak36-s9OtQw:a:2656895573,0.0,Ukraine War,donald trump hits back after harry s impassioned ukraine speech standard co uk news uk donald trump ukraine sussex duchess australia b html utm source flipboard utm medium activitypub posted into the evening standard the evening standard eveningstandard
Mastodon,2026-04-23,"# Maryland could have identified fraudulent lead inspections - https:// kensbookinfo.blogspot.com/p/et c.html#Australia EKO # Cyprus supports kids with cancer for 11th year - https:// kensbookinfo.blogspot.com/p/uk .html#9 # Machida Zelvia’s remarkable journey - https:// kensbookinfo.blogspot.com/p/us -capitals.html#Honolulu # Autopsy report shows assault, strangulation - https:// kensbookinfo.blogspot.com/p/ci ties.html#41a # Rwanda to Help Shape Who # Africa # Health Strategy - Regional - https:// kensbookinfo.blogspot.com/p/et c.html#Ukraine View all of Today Is... https:// kensbookinfo.blogspot.com/2026 /03/today-is.html",kensbookinfo,0,https://mastodon.social/ap/users/115622491419196539/statuses/116455541558303959,0.75,Ukraine War,maryland could have identified fraudulent lead inspections kensbookinfo blogspot com p et c html australia eko cyprus supports kids with cancer for th year kensbookinfo blogspot com p uk html machida zelvia s remarkable journey kensbookinfo blogspot com p us capitals html honolulu autopsy report shows assault strangulation kensbookinfo blogspot com p ci ties html a rwanda to help shape who africa health strategy regional kensbookinfo blogspot com p et c html ukraine view all of today is kensbookinfo blogspot com today is html
Mastodon,2026-04-23,"Inspired to launch a visual storytelling course at Berdyansk State Pedagogical University with Tim Winkler & Neil Bennett (Future Campus, Australia). More than photography — it’s about how we communicate ideas and science with impact. # VisualStorytelling # ScienceCommunication # HigherEd # Ukraine",yanasuchikova,0,https://mstdn.science/users/yanasuchikova/statuses/116454973157175052,0.16666666666666666,Ukraine War,inspired to launch a visual storytelling course at berdyansk state pedagogical university with tim winkler neil bennett future campus australia more than photography it s about how we communicate ideas and science with impact visualstorytelling sciencecommunication highered ukraine
Mastodon,2026-04-23,Prince Harry Makes Surprise Solo Trip Abroad Days After Returning From Australia With Meghan Markle https://www. instyle.com/prince-harry-surpr ise-solo-visit-ukraine-soon-after-meghan-markle-australia-trip-11956704?utm_source=flipboard&utm_medium=activitypub Posted into All Stories @ all-stories-instyle,instyle,0,https://flipboard.com/users/instyle/statuses/hEF_8HaBScaCSUYbYT05pw:a:29043301,0.0,Ukraine War,prince harry makes surprise solo trip abroad days after returning from australia with meghan markle instyle com prince harry surpr ise solo visit ukraine soon after meghan markle australia trip utm source flipboard utm medium activitypub posted into all stories all stories instyle
Mastodon,2026-04-23,Prince Harry makes unannounced visit to Ukraine after whirlwind Australia tour https://www. hellomagazine.com/royalty/8973 41/prince-harry-makes-unannounced-visit-ukraine/?utm_source=flipboard&utm_medium=activitypub Posted into Royal Family News @ royal-family-news-FlipboardUK,FlipboardUK,0,https://flipboard.com/users/FlipboardUK/statuses/IfZJ3cDZQlGHydXlIXmscA:a:26228122,0.0,Ukraine War,prince harry makes unannounced visit to ukraine after whirlwind australia tour hellomagazine com royalty prince harry makes unannounced visit ukraine utm source flipboard utm medium activitypub posted into royal family news royal family news flipboarduk
Mastodon,2026-04-23,Prince Harry makes unannounced visit to Ukraine after whirlwind Australia tour https://www. hellomagazine.com/royalty/8973 41/prince-harry-makes-unannounced-visit-ukraine/?utm_source=flipboard&utm_medium=activitypub Posted into Top Stories @ top-stories-HELLOMagazine,HELLOMagazine,0,https://flipboard.com/users/HELLOMagazine/statuses/SecdHctmS7qgdjPaipekeA:a:2139388226,0.5,Ukraine War,prince harry makes unannounced visit to ukraine after whirlwind australia tour hellomagazine com royalty prince harry makes unannounced visit ukraine utm source flipboard utm medium activitypub posted into top stories top stories hellomagazine
Mastodon,2026-04-23,Harry makes unannounced visit to Ukraine to ‘remind the world’ about the war https://www. the-independent.com/news/uk/ho me-news/ukraine-itv-news-kyiv-poland-australia-b2963279.html?utm_source=flipboard&utm_medium=activitypub Posted into Royal Family News @ royal-family-news-FlipboardUK,FlipboardUK,0,https://flipboard.com/users/FlipboardUK/statuses/hXCD79ORSe-U8aFpqM0rGw:a:26228122,0.0,Ukraine War,harry makes unannounced visit to ukraine to remind the world about the war the independent com news uk ho me news ukraine itv news kyiv poland australia b html utm source flipboard utm medium activitypub posted into royal family news royal family news flipboarduk
Mastodon,2026-04-22,Annual inflation rate: 🇻🇪 Venezuela: 649% 🇮🇷 Iran: 48.6% 🇦🇷 Argentina: 32.6% 🇹🇷 Türkiye: 30.87% 🇳🇬 Nigeria: 15.38% 🇪🇬 Egypt: 15.2% 🇱🇧 Lebanon: 12.3% 🇰🇿 Kazakhstan: 11.0% 🇧🇩 Bangladesh: 8.71% 🇺🇦 Ukraine: 7.9% 🇵🇰 Pakistan: 7.3% 🇷🇺 Russia: 5.9% 🇲🇽 Mexico: 4.59% 🇧🇷 Brazil: 4.14% 🇦🇺 Australia: 3.7% 🇮🇪 Ireland: 3.6% 🇳🇴 Norway: 3.6% 🇮🇩 Indonesia: 3.48% 🇮🇳 India: 3.4% 🇪🇸 Spain: 3.4% 🇬🇧 UK: 3.3% 🇺🇸 USA: 3.3% 🇦🇹 Austria: 3.2% 🇵🇱 Poland: 3.0% 🇿🇦 South Africa: 3.0% 🇩🇪 Germany: 2.7% 🇨🇦 Canada: 2.4% 🇰🇷 South Korea: 2.2% 🇦🇪 UAE: 2.04% 🇨🇿 Czechia: 1.9% 🇮🇱 Israel: 1.9% 🇭🇺 Hungary: 1.8% 🇸🇦 Saudi Arabia: 1.8% 🇫🇷 France: 1.7% 🇮🇹 Italy: 1.7% 🇸🇻 El Salvador: 1.47% 🇯🇵 Japan: 1.3% 🇩🇰 Denmark: 1.2% 🇸🇬 Singapore: 1.2% 🇨🇳 China: 1.0% 🇸🇪 Sweden: 0.6% 🇨🇭 Switzerland: 0.3% 🇹🇭 Thailand: -0.08% Source: Trading Economics,stats_feed,0,https://zpravobot.news/ap/users/116262997621803280/statuses/116447153998873330,0.0,Ukraine War,annual inflation rate venezuela iran argentina t rkiye nigeria egypt lebanon kazakhstan bangladesh ukraine pakistan russia mexico brazil australia ireland norway indonesia india spain uk usa austria poland south africa germany canada south korea uae czechia israel hungary saudi arabia france italy el salvador japan denmark singapore china sweden switzerland thailand source trading economics
Mastodon,2026-04-21,"First right in the constitution 📜👇 🇺🇸 USA - Freedom of speech 🇩🇪 Germany - Human dignity 🇫🇷 France - Equality 🇮🇳 India - Equality before law 🇮🇹 Italy - Work 🇪🇸 Spain - Liberty, justice, equality 🇵🇹 Portugal - Sovereignty of the people 🇳🇱 Netherlands - Equality 🇧🇪 Belgium - Equality before the law 🇨🇭 Switzerland - Dignity and rights of the people 🇯🇵 Japan - Popular sovereignty 🇰🇷 South Korea - Human dignity 🇨🇳 China - Socialist system 🇷🇺 Russia - Rights and freedoms 🇺🇦 Ukraine - Sovereignty￼ 🇹🇷 Turkey - National unity 🇧🇷 Brazil - Democratic state 🇲🇽 Mexico - Human rights 🇦🇷 Argentina - Federal union 🇨🇦 Canada - Rights and freedoms 🇦🇺 Australia - Federal union 🇿🇦 South Africa - Human dignity 🇪🇬 Egypt - Democratic state￼",stats_feed,0,https://zpravobot.news/ap/users/116262997621803280/statuses/116444181649769930,0.16224489795918368,Ukraine War,first right in the constitution usa freedom of speech germany human dignity france equality india equality before law italy work spain liberty justice equality portugal sovereignty of the people netherlands equality belgium equality before the law switzerland dignity and rights of the people japan popular sovereignty south korea human dignity china socialist system russia rights and freedoms ukraine sovereignty turkey national unity brazil democratic state mexico human rights argentina federal union canada rights and freedoms australia federal union south africa human dignity egypt democratic state
Mastodon,2026-04-21,"RE: https:// mastodon.world/@formuchdeliber ation/116444024891479454 Ukraine is finally breaking with the US, seeing that nothing is to be gained by appeasing Trump. Europe going the same way. Australia needs to learn the lesson. # auspol",johnquiggin,7,https://aus.social/users/johnquiggin/statuses/116444078109565167,0.0,Ukraine War,re mastodon world formuchdeliber ation ukraine is finally breaking with the us seeing that nothing is to be gained by appeasing trump europe going the same way australia needs to learn the lesson auspol
Mastodon,2026-04-20,"About a year ago President Zelenskyy said they need 16 Patriot Systems to help fully cover and defend Ukraine. Whilst I can't see them ever receiving that many, I wish the world would supply 16 or more Defence Systems EG the SAMP/T and IRIS-T systems. Australia should offer to buy four of these.",jessicaperthwa.bsky.social,0,https://bsky.brid.gy/convert/ap/at://did:plc:q5qu5sjtn44e7mpyri2qyugv/app.bsky.feed.post/3mjvhgn7xi22s,0.5,Ukraine War,about a year ago president zelenskyy said they need patriot systems to help fully cover and defend ukraine whilst i can t see them ever receiving that many i wish the world would supply or more defence systems eg the samp t and iris t systems australia should offer to buy four of these
Mastodon,2026-04-19,"""#Palestinian, # jewish and Proud""🇵🇸🕎❤️ A large percentage of Israelis are from European and Eurasian countries, while many born in Israel are mixed-race. https://www. instagram.com/reel/DXCpm-Bgk1g /?utm_source=ig_web_copy_link&igsh=NTc4MTIwNjQ2YQ== # israel # middleeast # antizionism # Russia # Ukraine # Belarus # SovietUnion # Romania # Poland # France # Germany # Austria # Hungary # CzechRepublic # Slovakia # UK # Bulgaria # Greece # Morocco # Algeria # Tunisia # Ethiopia # Libia # Egypt # Asia # Iran # Yemen # Turkey # India # Pakistan # United States # Canada # Australia # New Zealand # Argentina",Solomon_G,1,https://mastodon.social/ap/users/116259853317244662/statuses/116428686819835988,0.2751082251082251,Ukraine War,palestinian jewish and proud a large percentage of israelis are from european and eurasian countries while many born in israel are mixed race instagram com reel dxcpm bgk g utm source ig web copy link igsh ntc mtiwnjq yq israel middleeast antizionism russia ukraine belarus sovietunion romania poland france germany austria hungary czechrepublic slovakia uk bulgaria greece morocco algeria tunisia ethiopia libia egypt asia iran yemen turkey india pakistan united states canada australia new zealand argentina
Mastodon,2026-04-18,"Excellent half-hour documentary by the Kviv Independent on the Hungarian election. It's in English with excellent sub-titles for the parts in Hungarian.  Reporter is a Hungarian living in Ukraine but grew up in Australia, so there is a natural emphasis on the implications for the Ukrainian in the election.  But the documentary covers a lot of what ordinary Hungarians think about the election. You really do get a feel for the scale of the change Hungarians wanted. # Ukraine # Hungary # KvivIndependent https:// youtu.be/RQodYkiLU1E",paulh,0,https://cloudisland.nz/ap/users/116412982975886890/statuses/116422797984014420,0.2277777777777778,Ukraine War,excellent half hour documentary by the kviv independent on the hungarian election it s in english with excellent sub titles for the parts in hungarian reporter is a hungarian living in ukraine but grew up in australia so there is a natural emphasis on the implications for the ukrainian in the election but the documentary covers a lot of what ordinary hungarians think about the election you really do get a feel for the scale of the change hungarians wanted ukraine hungary kvivindependent youtu be rqodykilu e
Mastodon,2026-04-17,"Anti-imperialist Counter-narrative: They Always Tell You Why The Empire Uses Violence, But Never Why Its Enemies Do! They Always Tell You Why The Empire Uses Violence, But Never Why Its Enemies Do | Caitlin Johnstone | 16 APR 2026 One common feature of western empire propaganda is that we are always given reasons for the empire’s violence, while the violence of those who resist the empire tends to be framed as happening for no reason at all. We’ve all been fed reasons for the US-Israeli war on Iran, and we all know what those reasons are. Even less-informed members of the western public will have heard something about the Iranians being a nuclear threat, having a tyrannical government, and maybe something about sponsoring terrorist groups. But the so-called “peaceful protesters” who were killed in an uprising fomented and facilitated by the United States ? They were killed for no reason, simply because the Iranian government is evil and hates dissent. All the Iranian police officers who died in the uprising perished for no reason, perhaps of natural causes. It is only by pure coincidence that this happened at the exact same time the US empire was making the decision to try to topple the Iranian government. We’ve all been given the official reasons why Israel has spent years blanketing the Gaza Strip with military explosives: Israel was attacked by Hamas on October 7 2023, so it needs to get rid of Hamas for its own security. But why did the Hamas attack happen? It happened for no reason. If you look to the propagandists in the western press for answers, October 7 happened solely because Hamas are evil and wanted to kill Jews for belonging to the wrong religion. Absolutely no mention of Israel’s savage treatment of Palestinians for generations, or the dreadful living conditions imposed upon the giant concentration camp that Gaza had become. We’ve been told why the western empire is pouring weapons into Ukraine: Ukraine was invaded by Russia. The empire wants to protect the freedom and democracy of the Ukrainian people, and to deter future expansionism by Vladimir Putin. Why did Russia invade Ukraine? No reason. Putin’s just evil and hates freedom, that’s all. Sure, countless western experts and analysts had been warning for years that NATO aggressions were going to lead to a war on Russia’s border, but they were just rambling lunatics whose forecasts of war were proven correct by pure coincidence. Our entire understanding of history is framed in this way. Fidel Castro killed people in Cuba. Why did he kill them? No reason; he was just a mean jerk. All the violence of the socialist revolutionaries around the world overthrowing the abusive governments which preceded them is framed as causeless genocidal carnage inflicted by murderous tyrants who simply loved killing people. The desperation caused by the capitalist exploitation that had been imposed upon those populations is completely redacted from our history books. A mature understanding of our world begins with a curiosity about why the violence is happening. Violence is not always justified, but there is always a reason why it happens. Western pundits, politicians and newscasters will very seldom tell you what those reasons are unless it advances the interests of the western empire. So if you want to have a truth-based understanding of what’s really going on in our world, you need to actively seek out the answers for yourself. ______ source ______ ALSO SEE: “ Just me saying that we have a moral obligation, as humanity, to bring to a final end any and every establishment and political system, that, directly and/or indirectly participated in the Gaza Holocaust. And I don’t care if the whole world burns and the earth becomes mostly uninhabitable for 5 centuries. Let this be a lesson for the next civilization that comes after us. From Germany to the Persian Gulf, and from Australia to Canada: nothing must remain of the system that slaughtered Gaza and forced us to watch. That’s all .” – Alon Mizrahi The Mizrahi Perspective #Gaza #History #Iran #Israel #politics",truthaholics.wordpress.com,0,https://truthaholics.wordpress.com/?p=40131,-0.033024267399267386,Ukraine War,anti imperialist counter narrative they always tell you why the empire uses violence but never why its enemies do they always tell you why the empire uses violence but never why its enemies do caitlin johnstone apr one common feature of western empire propaganda is that we are always given reasons for the empire s violence while the violence of those who resist the empire tends to be framed as happening for no reason at all we ve all been fed reasons for the us israeli war on iran and we all know what those reasons are even less informed members of the western public will have heard something about the iranians being a nuclear threat having a tyrannical government and maybe something about sponsoring terrorist groups but the so called peaceful protesters who were killed in an uprising fomented and facilitated by the united states they were killed for no reason simply because the iranian government is evil and hates dissent all the iranian police officers who died in the uprising perished for no reason perhaps of natural causes it is only by pure coincidence that this happened at the exact same time the us empire was making the decision to try to topple the iranian government we ve all been given the official reasons why israel has spent years blanketing the gaza strip with military explosives israel was attacked by hamas on october so it needs to get rid of hamas for its own security but why did the hamas attack happen it happened for no reason if you look to the propagandists in the western press for answers october happened solely because hamas are evil and wanted to kill jews for belonging to the wrong religion absolutely no mention of israel s savage treatment of palestinians for generations or the dreadful living conditions imposed upon the giant concentration camp that gaza had become we ve been told why the western empire is pouring weapons into ukraine ukraine was invaded by russia the empire wants to protect the freedom and democracy of the ukrainian people and to deter future expansionism by vladimir putin why did russia invade ukraine no reason putin s just evil and hates freedom that s all sure countless western experts and analysts had been warning for years that nato aggressions were going to lead to a war on russia s border but they were just rambling lunatics whose forecasts of war were proven correct by pure coincidence our entire understanding of history is framed in this way fidel castro killed people in cuba why did he kill them no reason he was just a mean jerk all the violence of the socialist revolutionaries around the world overthrowing the abusive governments which preceded them is framed as causeless genocidal carnage inflicted by murderous tyrants who simply loved killing people the desperation caused by the capitalist exploitation that had been imposed upon those populations is completely redacted from our history books a mature understanding of our world begins with a curiosity about why the violence is happening violence is not always justified but there is always a reason why it happens western pundits politicians and newscasters will very seldom tell you what those reasons are unless it advances the interests of the western empire so if you want to have a truth based understanding of what s really going on in our world you need to actively seek out the answers for yourself source also see just me saying that we have a moral obligation as humanity to bring to a final end any and every establishment and political system that directly and or indirectly participated in the gaza holocaust and i don t care if the whole world burns and the earth becomes mostly uninhabitable for centuries let this be a lesson for the next civilization that comes after us from germany to the persian gulf and from australia to canada nothing must remain of the system that slaughtered gaza and forced us to watch that s all alon mizrahi the mizrahi perspective gaza history iran israel politics
Mastodon,2026-04-17,youtu.be/pCwaQh_hwyA?... . Ukraine are using ground robots to replace soldiers and save lives. This is what Australia needs to invest in given our small population for should we ever be invaded. #Auspol Ukraine Just Launched an INCRE...,jessicaperthwa.bsky.social,0,https://bsky.brid.gy/convert/ap/at://did:plc:q5qu5sjtn44e7mpyri2qyugv/app.bsky.feed.post/3mjo4q5lg7k2x,-0.25,Ukraine War,youtu be pcwaqh hwya ukraine are using ground robots to replace soldiers and save lives this is what australia needs to invest in given our small population for should we ever be invaded auspol ukraine just launched an incre
Mastodon,2026-04-17,"As part of Australia’s plan to upgrade our defence drones, we better be buying the technology from #Ukraine ! #AusPol @australianlabor.bsky.social@bsky.brid.gy RE: https://bsky.app/profile/did:plc:yazbevg3wkzp5llnzb44tqgh/post/3mjmgpie3gs2h",brucec01.bsky.social,1,https://bsky.brid.gy/convert/ap/at://did:plc:rrigcgajvpkngw5ewsmqznjj/app.bsky.feed.post/3mjnpgk7ums2i,0.625,Ukraine War,as part of australia s plan to upgrade our defence drones we better be buying the technology from ukraine auspol australianlabor bsky social bsky brid gy re
